"Headlines:","Date:"
"Three top-performing funds each racked up returns of more than 25 percent, helped by bets on small- and mid-cap growth stocks.","2019/04/12"
"The couple met in 2011 at a Halloween party at Trinity College, from which they graduated. The bride dressed up as the Tin Man and the groom dressed up as a Blue Man.","2019/03/17"
"Scott Foley and Maggie Greene star in a new, comedic spy series on ABC. And the Oscar-winning documentary “Free Solo” is available to rent online.","2019/02/27"
"Celebrate the 50th anniversary of the Apollo 11 moon landing with “First Man,” “For All Mankind” and more.","2019/07/20"
"Here’s what you need to know.","2019/06/04"
"A security consultant told Rolling Stone that at a concert, a device took fans’ photos for comparison with a database of potential stalkers.","2018/12/13"
"About 250 pilots for the carrier, ABX Air, went on strike on Tuesday, accusing their employer of forcing them to work an excessive number of flights.","2016/11/23"
"President Xi Jinping misjudged President Trump’s eagerness for a deal — and how far he could push the American negotiators.","2019/05/17"
"A docuseries about the Romanov family premieres on Netflix. And a film about one of the bloodiest incidents in British history comes to Amazon.","2019/07/03"
"Here’s what you need to know about the week’s top stories.","2019/07/14"
