"Headlines:","Date:"
"Amazon’s rawly honest comedy of marriage careens to a satisfying finish.","2019/03/13"
"A small and powerful society of Viners create Amazon’s reality. But is there such a thing as too much free stuff?","2019/01/26"
"Amazon’s offices in Queens will be built over an aging sewage system. The city says the pipes can handle the wastewater, but residents are worried.","2018/12/10"
"Subway leaders say the system is ready for Amazon’s new headquarters in Queens. But the city’s already struggling transportation network faces enormous challenges.","2018/11/20"
"Mayor Bill de Blasio wants to extend a cap on Uber vehicles. The tech giant is fighting back.","2019/02/19"
"Amazon defied expectations by splitting its second headquarters into two locations. For the internet company, it seems to be working out rather nicely.","2018/11/06"
"The legislation would ban New York City from entering into nondisclosure agreements during negotiations about prospective development projects.","2018/12/20"
"The company’s decision could be a turning point for corporate-civic relations in the U.S. and a sign that leftist views are gaining traction.","2019/02/15"
"Readers weigh in on the company’s minimum-pay increase.","2018/10/10"
"Every month, subscription streaming services add a new batch of titles to their libraries. Here are the ones we think are most interesting for May.","2019/05/01"
