"Headlines:","Date:"
"The untitled project, to be shot in Spain, is the director’s first since losing a major distribution deal in the wake of the #MeToo movement.","2019/06/04"
"Plus, Boeing’s plane problems are adding up, and Facebook prepares for a big fine — or a slap on the wrist?","2019/04/27"
"Big Tech is reducing consumer choice and harming innovation, according to a report ordered by the country’s top economic official.","2019/03/12"
"The acclaimed British actor died Thursday, leaving behind a body of work that spanned nearly six decades.","2019/02/08"
"Plus, will the Fed cave to pressure and lower interest rates?","2019/06/15"
"Steve Case has been on the road with J.D. Vance, the author of “Hillbilly Elegy,” to promote entrepreneurship across the United States.","2018/12/13"
"Wyatt Cenac’s late-night show returns to HBO. And Brie Larson’s directorial debut hits Netflix.","2019/04/05"
"The first skirmishes have already been fought in what could turn into a tech cold war. “The game is on,” said the Netflix chief executive, Reed Hastings.","2019/03/22"
"The video gaming industry is growing but it’s not clear which, if any sectors, are the most promising. Index funds have been a good solution lately.","2019/07/12"
"Also this week, why you should talk about global warming","2019/07/10"
