"Headlines:","Date:"
"Readers discuss the company’s process of choosing a city for its second headquarters.","2018/01/31"
"Look around at the Indian town of Leh, 11,562 feet up in the Himalayas.","video/embe"
"Scientists once ridiculed the idea of a living planet. Not anymore.","2019/04/20"
"Various approaches could lessen the economic shocks that globalization and technological change have delivered. Some might even be bipartisan.","2018/11/19"
"The Supreme Court’s decision to expand states’ ability to tax e-commerce sales hurt many online sellers. Except for the big one.","2018/06/21"
"Amazon has made home automation a major focus because of the success of its Echo family of products.","2018/02/27"
"The Midwest capital city would seem to be a long shot for Amazon’s new headquarters, but its low costs and business-friendly climate might help its chances.","2018/01/25"
"Here’s what you need to know to start your day.","2018/06/28"
"The retailer’s stock is soaring, but it wasn’t always that way. The company had lean years in which it told investors to have faith in its long-term strategy.","2018/02/04"
"Every month, subscription streaming services add a new batch of titles to their libraries. Here are the ones we think are most interesting for September.","2018/09/01"
