"Headlines:","Date:"
"The algorithms know what we’ll do, but not why we do it. At least not yet.","2019/05/28"
"Concluding that his tariff threat worked with Mexico, the president vowed to hit Beijing with more levies if it did not accede to America’s trade demands.","2019/06/11"
"Britain's FTSE 100 surged to its highest in nearly a year on Monday, as shares of Just Eat and London Stock Exchange rallied on deal-related news, while exporter stocks benefited from a weaker pound amid heightened 'no-deal' Brexit fears.","reuters/20"
"At a time when trust in its services is eroding, the social network introduced Portal and Portal Plus, its first major effort to build consumer hardware from scratch.","2018/10/08"
"Brazil was an influential player in efforts to tame climate warming and mitigate its effects. It is now moving in the opposite direction.","2018/11/28"
"Steve Case, chief executive of Revolution, speaking at The New York Times’s Cities for Tomorrow conference, described how cities that competed for and lost Amazon’s HQ2 could still see long-term benefits.","video/embe"
"Amy Sedaris offers dubious homemaking lessons in the second season of her parody show. And two nihilists profit from failed romances in a Netflix comedy.","2019/02/19"
"Hundreds of thousands of miles of cable connect continents to support our insatiable demand for communication and entertainment. Companies have typically pooled their resources. Now Google is going its own way.","interactiv"
"If recent increases are any indication, chances are your next iDevice will cost even more. We analyzed how prices have shot up and offer ways to buy for less.","2019/01/30"
"Both inside and outside the White House, there are growing calls for a weakening of China’s links to U.S. financial markets.","2019/05/29"
